"64","If you prefer that we do not use this information, you may opt out of online behavioral advertising. If you opt out, though, you may still receive generic advertising. In addition, financial advisors/Client Managers may continue to use information collected online to provide product and service information in accordance with account agreements. ","User Choice/Control"
"65","Also, if you opt out of online behavioral advertising, you may still see ads when you sign in to your account, for example through Online Banking or MyMerrill. These ads are based on your specific account relationships with us. ","Introductory/Generic"
"66","To learn more about relationship-based ads, online behavioral advertising and our privacy practices, please review the Bank of America Online Privacy Notice and our Online Privacy FAQs. ","Introductory/Generic"
"67","Bank of America, N.A. Member FDIC. Equal Housing Lender ","Introductory/Generic"
"68","2015 Bank of America Corporation. All rights reserved. ","Introductory/Generic"
"69","Important Notice ","Introductory/Generic"
"70","You're going to another website ","Other"
"71","Before you go, we want you to know the site owner is responsible for what's on their site. Also, their privacy practices and level of security may be different from ours, so please review their policies. ","Introductory/Generic"
"72","Continue Go back to Bank of America ","Other"
"73","Opt out of online behavioral advertising ","Other"
"74","When you opt out, we will not use information based on online Site behavior to provide online and offline tailored content and advertising to you, but you may still receive untailored advertising from Bank of America. In addition, financial advisors/Client Managers may continue to use information collected online to provide product and service information in accordance with account agreements. ","Introductory/Generic"
"75","Opting out also means the online content and advertising you receive on our non-servicing sites (before you sign in) will be untailored and will not be based on your online behavior or your relationship with us. ","Introductory/Generic"
"76","When accessing online account servicing areas (after you sign in), such as Online Banking or MyMerrill, you may receive tailored content and advertising based on your account relationships. ","Introductory/Generic"
"77","Important reminder: In order for this online behavioral advertising opt-out to work on your device, your browser must be set to accept cookies. If you delete cookies, buy a new device, access our Site from a different device, sign in under a different screen name or change web browsers, you will need to opt out again. ","Introductory/Generic"
"78","If your browser has scripting disabled, you do not need to opt out, as online behavioral advertising technology does not work when scripting is disabled. Please check your browser's security settings to validate whether scripting is active or disabled. ","User Choice/Control"
"79","The opt-out will take effect upon your next visit using the same device to Bank of America Sites. Click on ","Other"
"80"," Submit to opt out of online Site behavior used to provide to provide online and offline tailored content and advertising. Submit Cancel ","Other"
"81","You have successfully opted out of online behavioral advertising","Other"
"1","Last updated July 24, 2014 ","Other"
"3","Bank of America provides other online interfaces not covered by this Notice. If you visit or access your accounts from one of these sites, please review the online privacy practices of that site to understand how your online information may be collected, used and shared. ","Other"
"4","For U.S. account holders and visitors to this Site, we will use and share any information that we collect from or about you in accordance with the Bank of America U.S. Consumer Privacy Notice, which provides choices in the use and sharing of information. For Non-U.S. account holders utilizing this Site, we will use and share your account information in accordance with the privacy disclosure that covers your account and with the privacy and security rules applicable to the Bank of America affiliate or subsidiary that provides that account to you. ","First Party Collection/Use"
"4","For U.S. account holders and visitors to this Site, we will use and share any information that we collect from or about you in accordance with the Bank of America U.S. Consumer Privacy Notice, which provides choices in the use and sharing of information. For Non-U.S. account holders utilizing this Site, we will use and share your account information in accordance with the privacy disclosure that covers your account and with the privacy and security rules applicable to the Bank of America affiliate or subsidiary that provides that account to you. ","Third Party Sharing/Collection"
"5","Additional information on our Privacy Security practices may be found on our Sites and within Frequently Asked Questions (FAQs). Although the additional information is provided as a resource, the terms and conditions of this Notice control, and by using the Site, you agree to the terms and conditions of this Notice. ","Other"
"6"," Collecting and Using Information Personal Information We Collect Online Personal Information means personally identifiable information such as information you provide via forms, surveys, applications or other online fields including name, postal or email addresses, telephone, fax or mobile numbers, or account numbers. ","First Party Collection/Use"
"7"," How We Use Personal Information We may use Personal Information: ","Introductory/Generic"
"17","collected through our social media pages and other online interactions with you to assist in verifying your identity and account status. We may combine this online information with information collected from offline sources or information we already have; ","Other"
"21"," How Personal Information is Shared Please see the Bank of America U.S. Consumer Privacy Notice for information on how Personal Information may be shared and how you may be able to limit certain types of sharing. ","Introductory/Generic"
"22"," Other Information We Collect Online Other Information is any information other than Personal Information that does not reveal your specific identity or does not directly relate to an individual, such as browser information, information collected through cookies, pixel tags and other technologies, demographic information, other information provided by you such as your date of birth or household income, and aggregated and de-identified data. ","First Party Collection/Use"
"23"," How We Collect and Use Other Information We and our third-party service providers may collect and use Other Information in a variety of ways, including: ","Third Party Sharing/Collection"
"27","Other technologies including pixel tags, web beacons, and clear GIFs: These may be used in connection with some Site pages, downloadable mobile applications and HTML-formatted email messages to measure the effectiveness of our communications, the success of our marketing campaigns, to compile statistics about usage and response rates, to personalize/tailor your experience while engaging with us online and offline, for fraud detection and prevention, for security purposes, for advertising, and to assist us in resolving account holders questions regarding use of our Site. Please see our Advertising section below for more information regarding our use of other technologies. ","First Party Collection/Use"
"28","Flash objects: As part of our solutions for online authentication, we use Flash objects (sometimes referred to as Local Shared Objects) to help us recognize you and your device when you come back to the Site. For our pages running Adobe Flash content (demos and tutorials with moving content), we use Flash objects to determine your browser type and version of Adobe Flash in order for you to view the content. We do not use Flash objects for any online behavioral advertising purpose. Deleting cookies does not delete Flash objects. You can learn more about Flash objects - including how to control and disable them - through the Adobe interface. If you choose to disable Flash objects from our Site, then you may not be able to access and use all or part of the Site or benefit from the information and services offered. ","First Party Collection/Use"
"28","Flash objects: As part of our solutions for online authentication, we use Flash objects (sometimes referred to as Local Shared Objects) to help us recognize you and your device when you come back to the Site. For our pages running Adobe Flash content (demos and tutorials with moving content), we use Flash objects to determine your browser type and version of Adobe Flash in order for you to view the content. We do not use Flash objects for any online behavioral advertising purpose. Deleting cookies does not delete Flash objects. You can learn more about Flash objects - including how to control and disable them - through the Adobe interface. If you choose to disable Flash objects from our Site, then you may not be able to access and use all or part of the Site or benefit from the information and services offered. ","User Choice/Control"
"31"," Additional Information Third party widgets "" we may allow certain widgets (e.g., social share buttons) on our Sites that enable users to easily share information on another platform, such as a social media platform. The third parties that own these widgets may have access to information about your browsing on pages of our Sites where these widgets are placed. You may wish to review information at the third party site, such as social media platforms where you have an account, to determine how these third parties collect and treat such information. Also, see ","Other"
"36"," Online Behavioral Advertising We or our advertising service providers may use certain information about your activities on our Sites, such as pages visited and search key words entered to help determine which of our advertisements or offers may be of interest to you. We limit access and collection of information for specific purposes by advertising service providers. We may use this online information for online and offline advertising. ","Third Party Sharing/Collection"
"37"," Advertising on third party sites and mobile apps Bank of America contracts with advertising companies to advertise our products and services on sites and mobile apps not affiliated with us. We may use Aggregated and De-identified Data and information provided by you to these third party sites and mobile apps to select which of our advertisements or offers may appeal to you, display them to you and monitor your responses. Third Party sites and mobile apps are not subject to Bank of America Privacy Notices. Please visit the individual sites and mobile apps for additional information on their data and privacy practices and opt out policies. ","Other"
"38"," Online Behavioral Advertising on third party sites and mobile apps Some of our tailored ads are online behavioral advertising, and may be served using data collected by third party providers. Ads served on our behalf by these companies do not contain unencrypted Personal Information and we limit the use of information by companies that serve our ads. To learn more about this practice and your choices in connection with it, see the section ","Practice not covered"
"41","Opting out also means that the online content and advertising you receive on our non-servicing sites (i.e. before sign-in) will be untailored and will not be based on your online behavior or your relationship. ","Other"
"42","Please note that if you opt out of this advertising, you may still receive untailored advertising from Bank of America. When accessing online account servicing areas (i.e. after sign-in), such as Online Banking or MyMerrill, you may receive tailored content and advertising based on your account relationships. In addition, financial advisors/Client Managers may continue to use information collected online as described in this Notice to provide details on products and services in accordance with account agreements. See ","Other"
"43"," Important Reminder section below. Bank managed Direct Marketing: If you prefer we not deliver you marketing offers in email, postal mail or through telemarketing you may manage your direct marketing choices online or: by telephone at 1.888.341.5000 -our menu will prompt you through the choices, through your assigned account representative (e.g., Financial Advisor, Mortgage Loan Officer) or a representative at a banking center ","User Choice/Control"
"46","Please note that if you opt out, you may still receive untailored online advertising from Bank of America. Opting out from a specific third party site means that the ads you receive will not be tailored based on your choices or behavior. ","Other"
"47"," Important Reminder In order for online behavioral advertising opt outs from our Sites and on other sites to work on your device, your browser must be set to accept cookies. If you delete cookies, buy a new device, access our Site or other sites from a different device, login under a different screen name, or change web browsers, you will need to opt-out again. If your browser has scripting disabled, you do not need to opt out, as online behavioral advertising technology does not work when scripting is disabled. Please check your browser's security settings to validate whether scripting is active or disabled. ","Other"
"48"," Mobile Applications Bank of America's Mobile Applications for U.S. accounts (""Applications"") allows you to access your account balances and holdings, make deposits, transfers and pay bills on your mobile device. This Notice applies to any Personal Information or Other Information that we may collect through the Applications. ","Other"
"49"," Linking to other sites We may provide links to third party sites, such as credit bureaus, service providers or merchants. If you follow links to sites not affiliated or controlled by Bank of America, you should review their privacy and security policies and other terms and conditions, as they may be different from those of our Sites. Bank of America does not guarantee and is not responsible for the privacy or security of these sites, including the accuracy, completeness, or reliability of their information. ","Other"
"50"," Social media sites Bank of America provides experiences on social media platforms including, but not limited to, Facebook, Twitter, YouTube and LinkedIn that enable online sharing and collaboration among users who have registered to use them. Any content you post on official Bank of America managed social media pages, such as pictures, information, opinions, or any Personal Information that you make available to other participants on these social platforms, is subject to the Terms of Use and Privacy Policies of those respective platforms. Please refer to them to better understand your rights and obligations with regard to such content. In addition, please note that when visiting any official Bank of America social media pages, you are also subject to Bank of America's Privacy Notices, Social Media User Terms and Community Guidelines ","Other"
"54"," Making sure information is accurate Keeping your account information accurate and up to date is very important. If your account information is incomplete, inaccurate or not current, please use the Contact Us option on our Site, or call or write to us at the telephone numbers or appropriate address for changes listed on your account statements, records, online or other account materials. You can also speak to a customer representative at a banking center, your Financial Advisor or account representative. ","User Access, Edit and Deletion"
"56","Protecting individual health information To the extent that we receive, maintain, or process an individual's protected health information, Bank of America may disclose that information as authorized by and in accordance with applicable federal and/or state law. ","Third Party Sharing/Collection"
"62","We strive to provide you with information about products and services you might find interesting and useful. Relationship-based ads and online behavioral advertising help us do that. ","Other"
"65","Also, if you opt out of online behavioral advertising, you may still see ads when you sign in to your account, for example through Online Banking or MyMerrill. These ads are based on your specific account relationships with us. ","Other"
"66","To learn more about relationship-based ads, online behavioral advertising and our privacy practices, please review the Bank of America Online Privacy Notice and our Online Privacy FAQs. ","Other"
"67","Bank of America, N.A. Member FDIC. Equal Housing Lender ","Other"
"68","2015 Bank of America Corporation. All rights reserved. ","Other"
"69","Important Notice ","Other"
"71","Before you go, we want you to know the site owner is responsible for what's on their site. Also, their privacy practices and level of security may be different from ours, so please review their policies. ","Other"
"74","When you opt out, we will not use information based on online Site behavior to provide online and offline tailored content and advertising to you, but you may still receive untailored advertising from Bank of America. In addition, financial advisors/Client Managers may continue to use information collected online to provide product and service information in accordance with account agreements. ","Other"
"75","Opting out also means the online content and advertising you receive on our non-servicing sites (before you sign in) will be untailored and will not be based on your online behavior or your relationship with us. ","Other"
"76","When accessing online account servicing areas (after you sign in), such as Online Banking or MyMerrill, you may receive tailored content and advertising based on your account relationships. ","Other"
"77","Important reminder: In order for this online behavioral advertising opt-out to work on your device, your browser must be set to accept cookies. If you delete cookies, buy a new device, access our Site from a different device, sign in under a different screen name or change web browsers, you will need to opt out again. ","Other"
"78","If your browser has scripting disabled, you do not need to opt out, as online behavioral advertising technology does not work when scripting is disabled. Please check your browser's security settings to validate whether scripting is active or disabled. ","Other"
"14","to allow you to participate in surveys and other forms of market research, sweepstakes, contests and similar promotions and to administer these activities. Some of these activities have additional rules, which may contain additional information about how Personal Information is used and shared; ","Practice not covered"
"15","to allow you to use some Site financial planning tools. Information that you enter into one of these planning tools may be stored for future access and use. You have the option not to save the information; ","User Choice/Control"
"17","collected through our social media pages and other online interactions with you to assist in verifying your identity and account status. We may combine this online information with information collected from offline sources or information we already have; ","Practice not covered"
"21"," How Personal Information is Shared Please see the Bank of America U.S. Consumer Privacy Notice for information on how Personal Information may be shared and how you may be able to limit certain types of sharing. ","Other"
"23"," How We Collect and Use Other Information We and our third-party service providers may collect and use Other Information in a variety of ways, including: ","Introductory/Generic"
"25","Using cookies: Cookies are pieces of information stored directly on the device you are using. Cookies we use do not contain or capture unencrypted Personal Information. Cookies allow us to collect information such as browser type, time spent on the Site, pages visited, language preferences, and your relationship with us. We use the information for security purposes, to facilitate navigation, to display information more effectively, to personalize/tailor your experience while engaging with us, and to recognize your device to allow your use of our online products and services. We collect statistical information about the usage of the Site in order to continually improve the design and functionality, to monitor responses to our advertisements and content, to understand how account holders and visitors use the Site and to assist us with resolving questions regarding the Site. We also utilize cookies for advertising purposes. Please see the Advertising section below for more information. ","Other"
"27","Other technologies including pixel tags, web beacons, and clear GIFs: These may be used in connection with some Site pages, downloadable mobile applications and HTML-formatted email messages to measure the effectiveness of our communications, the success of our marketing campaigns, to compile statistics about usage and response rates, to personalize/tailor your experience while engaging with us online and offline, for fraud detection and prevention, for security purposes, for advertising, and to assist us in resolving account holders questions regarding use of our Site. Please see our Advertising section below for more information regarding our use of other technologies. ","Other"
"28","Flash objects: As part of our solutions for online authentication, we use Flash objects (sometimes referred to as Local Shared Objects) to help us recognize you and your device when you come back to the Site. For our pages running Adobe Flash content (demos and tutorials with moving content), we use Flash objects to determine your browser type and version of Adobe Flash in order for you to view the content. We do not use Flash objects for any online behavioral advertising purpose. Deleting cookies does not delete Flash objects. You can learn more about Flash objects - including how to control and disable them - through the Adobe interface. If you choose to disable Flash objects from our Site, then you may not be able to access and use all or part of the Site or benefit from the information and services offered. ","Practice not covered"
"29","IP Address: Your IP Address is a number that is automatically assigned to the device that you are using by your Internet Service Provider (ISP). An IP Address is identified and logged automatically in our server log files whenever a user visits the Site, along with the time of the visit and the page(s) that were visited. Collecting IP Addresses is standard practice on the internet and is done automatically by many web sites. We use IP Addresses for purposes such as calculating Site usage levels, helping diagnose server problems, to personalize/tailor your experience while engaging with us online and offline, for compliance and security purposes, for advertising, and administering the Site. Please see the Advertising section below for more information. ","Other"
"33","Bank of America uses information described in this Notice to help advertise our products and services, including prescreened offers of credit, in a variety of ways. We use such information to: ","Other"
"36"," Online Behavioral Advertising We or our advertising service providers may use certain information about your activities on our Sites, such as pages visited and search key words entered to help determine which of our advertisements or offers may be of interest to you. We limit access and collection of information for specific purposes by advertising service providers. We may use this online information for online and offline advertising. ","Data Security"
"37"," Advertising on third party sites and mobile apps Bank of America contracts with advertising companies to advertise our products and services on sites and mobile apps not affiliated with us. We may use Aggregated and De-identified Data and information provided by you to these third party sites and mobile apps to select which of our advertisements or offers may appeal to you, display them to you and monitor your responses. Third Party sites and mobile apps are not subject to Bank of America Privacy Notices. Please visit the individual sites and mobile apps for additional information on their data and privacy practices and opt out policies. ","User Choice/Control"
"37"," Advertising on third party sites and mobile apps Bank of America contracts with advertising companies to advertise our products and services on sites and mobile apps not affiliated with us. We may use Aggregated and De-identified Data and information provided by you to these third party sites and mobile apps to select which of our advertisements or offers may appeal to you, display them to you and monitor your responses. Third Party sites and mobile apps are not subject to Bank of America Privacy Notices. Please visit the individual sites and mobile apps for additional information on their data and privacy practices and opt out policies. ","Practice not covered"
"38"," Online Behavioral Advertising on third party sites and mobile apps Some of our tailored ads are online behavioral advertising, and may be served using data collected by third party providers. Ads served on our behalf by these companies do not contain unencrypted Personal Information and we limit the use of information by companies that serve our ads. To learn more about this practice and your choices in connection with it, see the section ","First Party Collection/Use"
