"38"," Online Behavioral Advertising on third party sites and mobile apps Some of our tailored ads are online behavioral advertising, and may be served using data collected by third party providers. Ads served on our behalf by these companies do not contain unencrypted Personal Information and we limit the use of information by companies that serve our ads. To learn more about this practice and your choices in connection with it, see the section ","Data Security"
"39"," Advertising Choices below Advertising Choices You may set your choices for advertising in the following ways: ","User Choice/Control"
"41","Opting out also means that the online content and advertising you receive on our non-servicing sites (i.e. before sign-in) will be untailored and will not be based on your online behavior or your relationship. ","User Choice/Control"
"42","Please note that if you opt out of this advertising, you may still receive untailored advertising from Bank of America. When accessing online account servicing areas (i.e. after sign-in), such as Online Banking or MyMerrill, you may receive tailored content and advertising based on your account relationships. In addition, financial advisors/Client Managers may continue to use information collected online as described in this Notice to provide details on products and services in accordance with account agreements. See ","Practice not covered"
"42","Please note that if you opt out of this advertising, you may still receive untailored advertising from Bank of America. When accessing online account servicing areas (i.e. after sign-in), such as Online Banking or MyMerrill, you may receive tailored content and advertising based on your account relationships. In addition, financial advisors/Client Managers may continue to use information collected online as described in this Notice to provide details on products and services in accordance with account agreements. See ","Third Party Sharing/Collection"
"44","Advertising on third party sites: Bank of America participates in the Digital Advertising Alliance (DAA) self-regulatory program, uses the Advertising Options Icon on our behavioral ads on third party sites (excluding ads appearing on platforms that do not accept the icon) and adheres to the DAA self-regulatory Principles for Online Behavioral Advertising. Anyone receiving a behavioral ad may click on the displayed icon to receive more information and can opt out at that time or by visiting the third party site's privacy policy for an opt out mechanism. ","Practice not covered"
"46","Please note that if you opt out, you may still receive untailored online advertising from Bank of America. Opting out from a specific third party site means that the ads you receive will not be tailored based on your choices or behavior. ","User Choice/Control"
"46","Please note that if you opt out, you may still receive untailored online advertising from Bank of America. Opting out from a specific third party site means that the ads you receive will not be tailored based on your choices or behavior. ","Practice not covered"
"47"," Important Reminder In order for online behavioral advertising opt outs from our Sites and on other sites to work on your device, your browser must be set to accept cookies. If you delete cookies, buy a new device, access our Site or other sites from a different device, login under a different screen name, or change web browsers, you will need to opt-out again. If your browser has scripting disabled, you do not need to opt out, as online behavioral advertising technology does not work when scripting is disabled. Please check your browser's security settings to validate whether scripting is active or disabled. ","Practice not covered"
"48"," Mobile Applications Bank of America's Mobile Applications for U.S. accounts (""Applications"") allows you to access your account balances and holdings, make deposits, transfers and pay bills on your mobile device. This Notice applies to any Personal Information or Other Information that we may collect through the Applications. ","Practice not covered"
"49"," Linking to other sites We may provide links to third party sites, such as credit bureaus, service providers or merchants. If you follow links to sites not affiliated or controlled by Bank of America, you should review their privacy and security policies and other terms and conditions, as they may be different from those of our Sites. Bank of America does not guarantee and is not responsible for the privacy or security of these sites, including the accuracy, completeness, or reliability of their information. ","Practice not covered"
"50"," Social media sites Bank of America provides experiences on social media platforms including, but not limited to, Facebook, Twitter, YouTube and LinkedIn that enable online sharing and collaboration among users who have registered to use them. Any content you post on official Bank of America managed social media pages, such as pictures, information, opinions, or any Personal Information that you make available to other participants on these social platforms, is subject to the Terms of Use and Privacy Policies of those respective platforms. Please refer to them to better understand your rights and obligations with regard to such content. In addition, please note that when visiting any official Bank of America social media pages, you are also subject to Bank of America's Privacy Notices, Social Media User Terms and Community Guidelines ","Third Party Sharing/Collection"
"50"," Social media sites Bank of America provides experiences on social media platforms including, but not limited to, Facebook, Twitter, YouTube and LinkedIn that enable online sharing and collaboration among users who have registered to use them. Any content you post on official Bank of America managed social media pages, such as pictures, information, opinions, or any Personal Information that you make available to other participants on these social platforms, is subject to the Terms of Use and Privacy Policies of those respective platforms. Please refer to them to better understand your rights and obligations with regard to such content. In addition, please note that when visiting any official Bank of America social media pages, you are also subject to Bank of America's Privacy Notices, Social Media User Terms and Community Guidelines ","Practice not covered"
"51"," Security To protect Personal Information from unauthorized access and use, we use security measures that comply with applicable federal and state laws. These measures may include device safeguards and secured files and buildings as well as oversight of our third party service providers to ensure information remains confidential and secure. Please visit bankofamerica.com/security for additional information. ","Other"
"52"," Using other aggregation websites Other companies offer aggregation websites and services that allow you to consolidate your financial account information from different sources (such as your accounts with us or with other financial institutions) so that you can view all your account information at one online location. To do this, an aggregation provider may request access to Personal Information, such as financial information, usernames and passwords. You should use caution and ensure that the aggregator company has appropriate policies and practices to protect the privacy and security of any information you provide or to which they are gaining access. We are not responsible for the use or disclosure of any Personal Information accessed by any company or person to whom you provide your Site username and password. ","Third Party Sharing/Collection"
"52"," Using other aggregation websites Other companies offer aggregation websites and services that allow you to consolidate your financial account information from different sources (such as your accounts with us or with other financial institutions) so that you can view all your account information at one online location. To do this, an aggregation provider may request access to Personal Information, such as financial information, usernames and passwords. You should use caution and ensure that the aggregator company has appropriate policies and practices to protect the privacy and security of any information you provide or to which they are gaining access. We are not responsible for the use or disclosure of any Personal Information accessed by any company or person to whom you provide your Site username and password. ","Practice not covered"
"53","If you provide your Site username, password or other information about your accounts with us to an aggregation website, we will consider that you have authorized all transactions or actions initiated by an aggregation website using access information you provide, whether or not you were aware of a specific transaction or action. If you decide to revoke the authority you have given to an aggregation website, we strongly recommend that you change your password for the Site to ensure that the aggregation website cannot continue to access your account. ","Third Party Sharing/Collection"
"55"," Protecting childrens privacy online The Site is not directed to individuals under the age of thirteen (13) and we request that these individuals do not provide Personal Information through the Site. We do not knowingly collect information from children under 13 without parental consent. Visit the Federal Trade Commission website for more information about the Children's Online Privacy Protection Act (COPPA). ","Other"
"55"," Protecting childrens privacy online The Site is not directed to individuals under the age of thirteen (13) and we request that these individuals do not provide Personal Information through the Site. We do not knowingly collect information from children under 13 without parental consent. Visit the Federal Trade Commission website for more information about the Children's Online Privacy Protection Act (COPPA). ","User Choice/Control"
"57"," Updates to this Privacy Notice This U.S. Online Privacy Notice is subject to change. Please review it periodically. If we make changes to the U.S. Online Privacy Notice, we will revise the Last Updated date at the top of this Notice. Any changes to this Notice will become effective when we post the revised Notice on the Site. Your use of the Site following these changes means that you accept the revised Notice. ","Other"
"58","Cookie Guide The use of cookies and similar technologies is a common internet practice. We have developed a Cookie Guide to provide very general information on cookies and similar technologies. ","Other"
"59","View cookie guide (PDF) ","Other"
"61","HomeAccessible BankingPrivacy Security CareersSite Map Advertising Practices Advertising Practices ","Introductory/Generic"
"64","If you prefer that we do not use this information, you may opt out of online behavioral advertising. If you opt out, though, you may still receive generic advertising. In addition, financial advisors/Client Managers may continue to use information collected online to provide product and service information in accordance with account agreements. ","Practice not covered"
"64","If you prefer that we do not use this information, you may opt out of online behavioral advertising. If you opt out, though, you may still receive generic advertising. In addition, financial advisors/Client Managers may continue to use information collected online to provide product and service information in accordance with account agreements. ","Third Party Sharing/Collection"
"65","Also, if you opt out of online behavioral advertising, you may still see ads when you sign in to your account, for example through Online Banking or MyMerrill. These ads are based on your specific account relationships with us. ","Practice not covered"
"73","Opt out of online behavioral advertising ","Introductory/Generic"
"74","When you opt out, we will not use information based on online Site behavior to provide online and offline tailored content and advertising to you, but you may still receive untailored advertising from Bank of America. In addition, financial advisors/Client Managers may continue to use information collected online to provide product and service information in accordance with account agreements. ","First Party Collection/Use"
"74","When you opt out, we will not use information based on online Site behavior to provide online and offline tailored content and advertising to you, but you may still receive untailored advertising from Bank of America. In addition, financial advisors/Client Managers may continue to use information collected online to provide product and service information in accordance with account agreements. ","Third Party Sharing/Collection"
"75","Opting out also means the online content and advertising you receive on our non-servicing sites (before you sign in) will be untailored and will not be based on your online behavior or your relationship with us. ","User Choice/Control"
"76","When accessing online account servicing areas (after you sign in), such as Online Banking or MyMerrill, you may receive tailored content and advertising based on your account relationships. ","First Party Collection/Use"
"77","Important reminder: In order for this online behavioral advertising opt-out to work on your device, your browser must be set to accept cookies. If you delete cookies, buy a new device, access our Site from a different device, sign in under a different screen name or change web browsers, you will need to opt out again. ","Practice not covered"
"78","If your browser has scripting disabled, you do not need to opt out, as online behavioral advertising technology does not work when scripting is disabled. Please check your browser's security settings to validate whether scripting is active or disabled. ","Practice not covered"
"79","The opt-out will take effect upon your next visit using the same device to Bank of America Sites. Click on ","Practice not covered"
"80"," Submit to opt out of online Site behavior used to provide to provide online and offline tailored content and advertising. Submit Cancel ","User Choice/Control"
