"0","lynda.com Privacy Policy ","Introductory/Generic"
"64","12. LINKS TO THIRD PARTY WEB SITES AND ADVERTISERS Except as otherwise discussed in this Privacy Policy, this document only addresses the use and disclosure of information we collect from you. Our Websites may contain hyperlinks to other third-party web sites, which may collect and disclose information in a manner that is different from our Websites. We are not responsible for the collection, use, or disclosure of information collected through these third-party web sites, and we expressly disclaim any and all liability related to such collection, use, or disclosure. We recommend that you read the privacy policies of the other web sites you visit. Additionally, other companies that place advertising on our Websites may collect information about you when you view or click on their advertising through the use of cookies. We cannot control this collection of information. You should contact these advertisers directly if you have any questions about their use of the information that they collect. ","Third Party Sharing/Collection"
"64","12. LINKS TO THIRD PARTY WEB SITES AND ADVERTISERS Except as otherwise discussed in this Privacy Policy, this document only addresses the use and disclosure of information we collect from you. Our Websites may contain hyperlinks to other third-party web sites, which may collect and disclose information in a manner that is different from our Websites. We are not responsible for the collection, use, or disclosure of information collected through these third-party web sites, and we expressly disclaim any and all liability related to such collection, use, or disclosure. We recommend that you read the privacy policies of the other web sites you visit. Additionally, other companies that place advertising on our Websites may collect information about you when you view or click on their advertising through the use of cookies. We cannot control this collection of information. You should contact these advertisers directly if you have any questions about their use of the information that they collect. ","Practice not covered"
"65","13. NOTICE TO CALIFORNIA RESIDENTS - CALIFORNIA PRIVACY RIGHTS If you are a California resident and have provided us with Personally Identifiable Information, California law gives you the right to request and receive from us, once per calendar year, information as to how we have shared your Personally Identifiable Information with third parties for their direct marketing purposes If applicable, such information would include a list of names and addresses of all third parties with whom such information was shared during the prior calendar year as well as a list of the categories of Personally Identifiable Information shared. To make such a request, please send an email to businessaffairs@lynda.com and include the phrase California Privacy Request in the subject line. Your request must also include your name, physical mailing address and email address. We will respond to you within thirty days of receiving such a request. ","First Party Collection/Use"
"65","13. NOTICE TO CALIFORNIA RESIDENTS - CALIFORNIA PRIVACY RIGHTS If you are a California resident and have provided us with Personally Identifiable Information, California law gives you the right to request and receive from us, once per calendar year, information as to how we have shared your Personally Identifiable Information with third parties for their direct marketing purposes If applicable, such information would include a list of names and addresses of all third parties with whom such information was shared during the prior calendar year as well as a list of the categories of Personally Identifiable Information shared. To make such a request, please send an email to businessaffairs@lynda.com and include the phrase California Privacy Request in the subject line. Your request must also include your name, physical mailing address and email address. We will respond to you within thirty days of receiving such a request. ","User Access, Edit and Deletion"
"65","13. NOTICE TO CALIFORNIA RESIDENTS - CALIFORNIA PRIVACY RIGHTS If you are a California resident and have provided us with Personally Identifiable Information, California law gives you the right to request and receive from us, once per calendar year, information as to how we have shared your Personally Identifiable Information with third parties for their direct marketing purposes If applicable, such information would include a list of names and addresses of all third parties with whom such information was shared during the prior calendar year as well as a list of the categories of Personally Identifiable Information shared. To make such a request, please send an email to businessaffairs@lynda.com and include the phrase California Privacy Request in the subject line. Your request must also include your name, physical mailing address and email address. We will respond to you within thirty days of receiving such a request. ","Privacy contact information"
"66","Note, that we will not share your Personally Identifiable Information with third parties for their marketing purposes without obtaining your prior consent. Moreover, if you have granted us permission, such third parties use of your Personally Identifiable Information will be subject to their privacy policies. You should contact those entities directly regarding any communications you may receive from them, including, if you later decide that you no longer want that third party to use your personal information. ","Third Party Sharing/Collection"
"66","Note, that we will not share your Personally Identifiable Information with third parties for their marketing purposes without obtaining your prior consent. Moreover, if you have granted us permission, such third parties use of your Personally Identifiable Information will be subject to their privacy policies. You should contact those entities directly regarding any communications you may receive from them, including, if you later decide that you no longer want that third party to use your personal information. ","Practice not covered"
"69","If we make material changes to how we use Personal Information collected from children under 13, we will notify parents by email in order to obtain verifiable parental consent for the new uses of their childs Personally Identifiable Information. ","Policy Change"
"70","15. COMMUNITIES, FORUMS, CHAT ROOMS, AND MESSAGE BOARDS If you or your child choose to disclose Personally Identifiable Information on communities, message boards, forums, and the like, which may be accessible via the Websites, you should be aware that such information, along with any information disclosed in your communication, can be collected and used by third parties and may result in unsolicited messages from third parties. To request removal of your personal information from our blog or community forum, contact us at support@lynda.com. You acknowledge and accept that any submissions to chat rooms or other public areas on the Websites are accessible to all third parties. If you do not want yours or your childs comments to be viewed by third parties, you are advised not to make any submissions. Ultimately, you are solely responsible for all activity conducted by you via communities, forums, message boards, chat rooms, etc. Please be careful and responsible whenever you are online. ","First Party Collection/Use"
"70","15. COMMUNITIES, FORUMS, CHAT ROOMS, AND MESSAGE BOARDS If you or your child choose to disclose Personally Identifiable Information on communities, message boards, forums, and the like, which may be accessible via the Websites, you should be aware that such information, along with any information disclosed in your communication, can be collected and used by third parties and may result in unsolicited messages from third parties. To request removal of your personal information from our blog or community forum, contact us at support@lynda.com. You acknowledge and accept that any submissions to chat rooms or other public areas on the Websites are accessible to all third parties. If you do not want yours or your childs comments to be viewed by third parties, you are advised not to make any submissions. Ultimately, you are solely responsible for all activity conducted by you via communities, forums, message boards, chat rooms, etc. Please be careful and responsible whenever you are online. ","Privacy contact information"
"70","15. COMMUNITIES, FORUMS, CHAT ROOMS, AND MESSAGE BOARDS If you or your child choose to disclose Personally Identifiable Information on communities, message boards, forums, and the like, which may be accessible via the Websites, you should be aware that such information, along with any information disclosed in your communication, can be collected and used by third parties and may result in unsolicited messages from third parties. To request removal of your personal information from our blog or community forum, contact us at support@lynda.com. You acknowledge and accept that any submissions to chat rooms or other public areas on the Websites are accessible to all third parties. If you do not want yours or your childs comments to be viewed by third parties, you are advised not to make any submissions. Ultimately, you are solely responsible for all activity conducted by you via communities, forums, message boards, chat rooms, etc. Please be careful and responsible whenever you are online. ","User Choice/Control"
"70","15. COMMUNITIES, FORUMS, CHAT ROOMS, AND MESSAGE BOARDS If you or your child choose to disclose Personally Identifiable Information on communities, message boards, forums, and the like, which may be accessible via the Websites, you should be aware that such information, along with any information disclosed in your communication, can be collected and used by third parties and may result in unsolicited messages from third parties. To request removal of your personal information from our blog or community forum, contact us at support@lynda.com. You acknowledge and accept that any submissions to chat rooms or other public areas on the Websites are accessible to all third parties. If you do not want yours or your childs comments to be viewed by third parties, you are advised not to make any submissions. Ultimately, you are solely responsible for all activity conducted by you via communities, forums, message boards, chat rooms, etc. Please be careful and responsible whenever you are online. ","International and Specific Audiences"
"70","15. COMMUNITIES, FORUMS, CHAT ROOMS, AND MESSAGE BOARDS If you or your child choose to disclose Personally Identifiable Information on communities, message boards, forums, and the like, which may be accessible via the Websites, you should be aware that such information, along with any information disclosed in your communication, can be collected and used by third parties and may result in unsolicited messages from third parties. To request removal of your personal information from our blog or community forum, contact us at support@lynda.com. You acknowledge and accept that any submissions to chat rooms or other public areas on the Websites are accessible to all third parties. If you do not want yours or your childs comments to be viewed by third parties, you are advised not to make any submissions. Ultimately, you are solely responsible for all activity conducted by you via communities, forums, message boards, chat rooms, etc. Please be careful and responsible whenever you are online. ","Practice not covered"
"71","16. SOCIAL MEDIA FEATURES Our Websites include Social Media Features, such as the Add This button or interactive mini-programs that run on our Websites. These features may collect your IP address, which pages you are visiting on our Websites, and may set cookies to enable the features to function properly. Social Media Features are either hosted by a third party or hosted directly on our Websites. Your interactions with these features are governed by the privacy policy of the company providing it. ","Practice not covered"
"72","17. GIFT CERTIFICATES AND PLAYLISTS If you choose to send a gift certificate or playlist to an individual, we will ask you for the individuals name and email address. We will automatically send a one-time email to the individual either with notice of their gift certificate along with an activation key or an invitation to visit the Websites. The recipient will be asked to create a user name and password to activate their subscription, and during this process, they will also be asked if they want to receive any newsletters or other emails from lynda.com. lynda.com stores name and email address of the recipient for the sole purpose of sending this one-time email and tracking the success of our referral program. The individual may contact us at support@lynda.com to request that we remove this information from our database. ","Data Retention"
"72","17. GIFT CERTIFICATES AND PLAYLISTS If you choose to send a gift certificate or playlist to an individual, we will ask you for the individuals name and email address. We will automatically send a one-time email to the individual either with notice of their gift certificate along with an activation key or an invitation to visit the Websites. The recipient will be asked to create a user name and password to activate their subscription, and during this process, they will also be asked if they want to receive any newsletters or other emails from lynda.com. lynda.com stores name and email address of the recipient for the sole purpose of sending this one-time email and tracking the success of our referral program. The individual may contact us at support@lynda.com to request that we remove this information from our database. ","Privacy contact information"
"72","17. GIFT CERTIFICATES AND PLAYLISTS If you choose to send a gift certificate or playlist to an individual, we will ask you for the individuals name and email address. We will automatically send a one-time email to the individual either with notice of their gift certificate along with an activation key or an invitation to visit the Websites. The recipient will be asked to create a user name and password to activate their subscription, and during this process, they will also be asked if they want to receive any newsletters or other emails from lynda.com. lynda.com stores name and email address of the recipient for the sole purpose of sending this one-time email and tracking the success of our referral program. The individual may contact us at support@lynda.com to request that we remove this information from our database. ","User Choice/Control"
"3","lynda.com has been awarded TRUSTe's Privacy and Children's Privacy Seal signifying that this Privacy Policy and practices of lynda.com, have been reviewed by TRUSTe for compliance with TRUSTe's Web Privacy and the TRUSTed Cloud Program Requirements including transparency, accountability and choice regarding the collection and use of your personal information. TRUSTe's mission, as an independent third party, is to accelerate online trust among consumers and organizations globally through its leading privacy trustmark and innovative trust solutions. If you have questions or complaints regarding our privacy policy or practices, please contact us at businessaffairs@lynda.com. If you are not satisfied with our response you can contact TRUSTe here. ","Introductory/Generic"
"4","The TRUSTe program covers information collected through the websites www.lynda.com, m.lynda.com and www.video2brain.com, the lynda.com mobile application, and the service platform associated with this website. ","Introductory/Generic"
"6","lynda.com privacy practices described in this Policy comply with the APEC Cross Border Privacy Rules System. ","Introductory/Generic"
"8","By accessing or using our Services, you agree to this Privacy Policy. ","Introductory/Generic"
"9","IF YOU DO NOT AGREE TO THIS PRIVACY POLICY, PLEASE DO NOT ACCESS OR USE OUR SERVICES. ","Introductory/Generic"
"28","DISCLOSURE OF YOUR INFORMATION We will share your Personally Identifiable Information with third parties only in the ways that are described in this Privacy Policy. Parents have the right to allow the collection and use of Personal Information from a Child without also consenting to its disclosure to Third Parties. We do not sell, trade, rent or disclose your information to others, except as provided herein: ","User Choice/Control"
"34","For a list of 3rd party trackers and the information that may be shared with or collected by such 3rd parties, please click here: lynda.com 3rd parties ","Introductory/Generic"
"45","We do not send unsolicited commercial e-mails. We offer commercial e-mail recipients the opportunity to opt-out of further communications in every e-mail. Please note that we may not include the opt-out information in non-commercial Service e-mails (i.e., e-mails concerning your order, the Website Terms of Service, etc.). ","Other"
"46","You also have choices with respect to cookies, as described below. By modifying your browser preferences, you have the choice to accept all cookies, to be notified when a cookie is set, or to reject all cookies. If you choose to reject all cookies some parts of our Websites may not work properly in your case. ","First Party Collection/Use"
"47","8. INFORMATION RELATED TO DATA COLLECTED THROUGH THE LYNDA.COM PLATFORM SERVICE For certain services lynda.com collects information under the direction of its clients (e.g., an entity that subscribes to the Services for use by the entitys personnel). In this respect, lynda.com acts as a data processor and has no direct relationship with the individuals whose Personally Identifiable Information it processes. An individual who seeks access, or who seeks to correct, amend, or delete inaccurate data should direct his or her query to the relevant lynda.com client (the data controller). If the client makes a request to us to remove the data, we will respond to their request within 30 days. ","First Party Collection/Use"
"59","You can disable and/or delete all types of cookies by using your browser settings. Cookies are generally easy to disable and/or delete but how you do so varies from browser to browser. The help function within your browser should tell you how to do it. The best way may be to close your browser and then search for cookie folder or cookie manager or simply cookie. Please also visit www.allaboutcookies.org for more information about cookies and how to disable them. If you do disable cookies, our Websites will not recognize you and you may not have access to all portions of the Websites. ","First Party Collection/Use"
"60","What are clear gifs? Clear gifs are tiny graphics with a unique identifier, similar in function to cookies, and are used to track the online movements of Web users. In contrast to cookies, which are stored on a users computer hard drive, clear gifs are embedded invisibly on Web pages and are about the size of the full-stop or period at the end of this sentence. ","First Party Collection/Use"
"72","17. GIFT CERTIFICATES AND PLAYLISTS If you choose to send a gift certificate or playlist to an individual, we will ask you for the individuals name and email address. We will automatically send a one-time email to the individual either with notice of their gift certificate along with an activation key or an invitation to visit the Websites. The recipient will be asked to create a user name and password to activate their subscription, and during this process, they will also be asked if they want to receive any newsletters or other emails from lynda.com. lynda.com stores name and email address of the recipient for the sole purpose of sending this one-time email and tracking the success of our referral program. The individual may contact us at support@lynda.com to request that we remove this information from our database. ","First Party Collection/Use"
