"0","lynda.com Privacy Policy ","Introductory/Generic"
"43","With respect to your communications preferences, you can unsubscribe from newsletters by following the instructions included in the newsletter you receive or you can log into your account and update your newsletter and email subscription options. If your e-mail address has changed and you would like to continue to receive newsletters, you will need to access your account and update your e-mail address information in your account and sign-up again for the newsletter. Occasionally we may send out e-mails concerning website disruptions. ","Practice not covered"
"44","If you indicated upon registration that you are interested in receiving offers or information from us and our partners, we may occasionally send you direct mail about products and services that we feel may be of interest to you. Only lynda.com (or agents working on behalf of us and under confidentiality agreements) will send you these direct mailings, and only if you did not later opt-out of such offers. ","First Party Collection/Use"
"44","If you indicated upon registration that you are interested in receiving offers or information from us and our partners, we may occasionally send you direct mail about products and services that we feel may be of interest to you. Only lynda.com (or agents working on behalf of us and under confidentiality agreements) will send you these direct mailings, and only if you did not later opt-out of such offers. ","Third Party Sharing/Collection"
"45","We do not send unsolicited commercial e-mails. We offer commercial e-mail recipients the opportunity to opt-out of further communications in every e-mail. Please note that we may not include the opt-out information in non-commercial Service e-mails (i.e., e-mails concerning your order, the Website Terms of Service, etc.). ","User Choice/Control"
"46","You also have choices with respect to cookies, as described below. By modifying your browser preferences, you have the choice to accept all cookies, to be notified when a cookie is set, or to reject all cookies. If you choose to reject all cookies some parts of our Websites may not work properly in your case. ","User Choice/Control"
"47","8. INFORMATION RELATED TO DATA COLLECTED THROUGH THE LYNDA.COM PLATFORM SERVICE For certain services lynda.com collects information under the direction of its clients (e.g., an entity that subscribes to the Services for use by the entitys personnel). In this respect, lynda.com acts as a data processor and has no direct relationship with the individuals whose Personally Identifiable Information it processes. An individual who seeks access, or who seeks to correct, amend, or delete inaccurate data should direct his or her query to the relevant lynda.com client (the data controller). If the client makes a request to us to remove the data, we will respond to their request within 30 days. ","User Access, Edit and Deletion"
"48","lynda.com will retain Personally Identifiable Information we process on behalf of our clients for as long as needed to provide our services to our client. We will retain and use this personal information as necessary to comply with our legal obligations, resolve disputes, and enforce our agreements. ","Data Retention"
"49","9. DATA SECURITY All information you provide to us is stored on our secure servers. Any payment transactions will be encrypted using Secure Sockets Layer (SSL) technology. ","Data Security"
"50","To make online purchases you must use an SSL-enabled browser in order to protect the confidentiality of your personal and credit card information while it is transmitted over the Internet. ","Data Security"
"51","Access by you to your account is available through a password and/or unique user name selected by you. This password is encrypted. We recommend that you do not divulge your password to anyone, that you change your password often using a combination of letters and numbers, and that you ensure you use a secure web browser. We cannot be held accountable for activity that results from your own neglect to safeguard the secrecy of your password and user name. If you share a computer with anyone, you should always log out of your account after you are finished, in order to prevent access to your information from subsequent users of that computer. ","Data Security"
"52","Please notify us as soon as possible if your user name or password is compromised. Call 1 (888) 335-9632 or +1 (805) 477-3900 for assistance, or email businessaffairs@lynda.com. ","Privacy contact information"
"53","Unfortunately, no data transmission over the Internet or any wireless network can be guaranteed to be 100% secure. As a result, while we strive to protect your Personally Identifiable Information, you acknowledge that: (a) there are security and privacy limitations of the Internet which are beyond our control; (b) the security, integrity and privacy of any and all information and data exchanged between you and us through this Website cannot be guaranteed and we shall have no liability to you or any third party for loss, misuse, disclosure or alteration of such information; and (c) any such information and data may be viewed or tampered with in transit by a third party. ","Other"
"54","In the unlikely event that we believe that the security of your Personally Identifiable Information in our control may have been compromised, we will notify you as promptly as possible under the circumstances. To the extent we have your e-mail address, we may notify you by e-mail and you consent to our use of e-mail as a means of such notification. If you prefer for us to use another method to notify you in this situation, please e-mail us at businessaffairs@lynda.com with the alternative contact information you wish to be used. ","Data Security"
"55","10. COOKIES AND OTHER TECHNOLOGIES When you use our Websites we may use cookies and other technologies in order to facilitate and customize your use of our Services. ","First Party Collection/Use"
"56","What is a cookie? A cookie is a small data text file, which a website stores on your computer or mobile device (if your Web browser permits) that can later be retrieved to identify you to us. ","Introductory/Generic"
"57","Our cookies store randomly assigned user identification numbers, the country where you are located, and your first name to welcome you back to our Websites. The cookies make your use of the Websites easier, make the Websites run more smoothly, and save your logged-in state so that you do not have to log in each time that you visit the Websites. ","First Party Collection/Use"
"58","The use of cookies by our partners, affiliates, tracking utility company and service providers, is not covered by our Privacy Policy. We do not have access or control over these cookies. Our partners, affiliates, tracking utility company, and service providers, use session ID cookies to make it easier for you to navigate our site, in order for you to use the shopping cart, etc. ","Third Party Sharing/Collection"
"59","You can disable and/or delete all types of cookies by using your browser settings. Cookies are generally easy to disable and/or delete but how you do so varies from browser to browser. The help function within your browser should tell you how to do it. The best way may be to close your browser and then search for cookie folder or cookie manager or simply cookie. Please also visit www.allaboutcookies.org for more information about cookies and how to disable them. If you do disable cookies, our Websites will not recognize you and you may not have access to all portions of the Websites. ","User Choice/Control"
"60","What are clear gifs? Clear gifs are tiny graphics with a unique identifier, similar in function to cookies, and are used to track the online movements of Web users. In contrast to cookies, which are stored on a users computer hard drive, clear gifs are embedded invisibly on Web pages and are about the size of the full-stop or period at the end of this sentence. ","Introductory/Generic"
"61","We partner with third party ad networks to manage our advertising on other sites. As part of their service, they use cookies and clear gifs. We will not provide any third-party ad server with any of your Personally Identifiable Information or information about your purchases. We and our third party ad server will collect and use your IP address and certain Non-Personally Identifiable Information about you, such as your browser type, the server your computer is logged onto, the area code and zip code associated with your server and whether you responded to a particular advertisement. If you wish to not have this information used for the purpose of serving you targeted ads, you may opt-out by clicking here. Please note this does not opt you out of being served advertising. You will continue to receive generic ads. ","Third Party Sharing/Collection"
"62","What is a Flash cookie? Local storage objects, also known as Flash cookies, are similar in function to browser cookies in that they store some information about you or your activities on our Websites. We use Flash cookies in certain situations where we use Flash to provide some content such as video clips or animation. The options within your browser may not prevent the setting of Flash cookies. To manage Flash cookies please click here: http://www.macromedia.com/support/documentation/en/flashplayer/help/settings_manager07.html. ","Introductory/Generic"
"62","What is a Flash cookie? Local storage objects, also known as Flash cookies, are similar in function to browser cookies in that they store some information about you or your activities on our Websites. We use Flash cookies in certain situations where we use Flash to provide some content such as video clips or animation. The options within your browser may not prevent the setting of Flash cookies. To manage Flash cookies please click here: http://www.macromedia.com/support/documentation/en/flashplayer/help/settings_manager07.html. ","First Party Collection/Use"
"62","What is a Flash cookie? Local storage objects, also known as Flash cookies, are similar in function to browser cookies in that they store some information about you or your activities on our Websites. We use Flash cookies in certain situations where we use Flash to provide some content such as video clips or animation. The options within your browser may not prevent the setting of Flash cookies. To manage Flash cookies please click here: http://www.macromedia.com/support/documentation/en/flashplayer/help/settings_manager07.html. ","User Choice/Control"
"63","11. MOBILE ANALYTICS We use mobile analytics software to allow us to better understand the functionality of our mobile software on your phone. This software may record information such as how often you use the App, the events that occur within the App, aggregated usage, performance data, and where the App was downloaded from. We do not link the information we store within the analytics software to any Personally Identifiable Information you submit within the App. ","First Party Collection/Use"
"64","12. LINKS TO THIRD PARTY WEB SITES AND ADVERTISERS Except as otherwise discussed in this Privacy Policy, this document only addresses the use and disclosure of information we collect from you. Our Websites may contain hyperlinks to other third-party web sites, which may collect and disclose information in a manner that is different from our Websites. We are not responsible for the collection, use, or disclosure of information collected through these third-party web sites, and we expressly disclaim any and all liability related to such collection, use, or disclosure. We recommend that you read the privacy policies of the other web sites you visit. Additionally, other companies that place advertising on our Websites may collect information about you when you view or click on their advertising through the use of cookies. We cannot control this collection of information. You should contact these advertisers directly if you have any questions about their use of the information that they collect. ","Other"
"65","13. NOTICE TO CALIFORNIA RESIDENTS - CALIFORNIA PRIVACY RIGHTS If you are a California resident and have provided us with Personally Identifiable Information, California law gives you the right to request and receive from us, once per calendar year, information as to how we have shared your Personally Identifiable Information with third parties for their direct marketing purposes If applicable, such information would include a list of names and addresses of all third parties with whom such information was shared during the prior calendar year as well as a list of the categories of Personally Identifiable Information shared. To make such a request, please send an email to businessaffairs@lynda.com and include the phrase California Privacy Request in the subject line. Your request must also include your name, physical mailing address and email address. We will respond to you within thirty days of receiving such a request. ","International and Specific Audiences"
"66","Note, that we will not share your Personally Identifiable Information with third parties for their marketing purposes without obtaining your prior consent. Moreover, if you have granted us permission, such third parties use of your Personally Identifiable Information will be subject to their privacy policies. You should contact those entities directly regarding any communications you may receive from them, including, if you later decide that you no longer want that third party to use your personal information. ","User Choice/Control"
"67","14. CHANGES TO THIS PRIVACY POLICY It is our policy to post any changes we make to our Privacy Policy on this page (with a notice that the Privacy Policy has been updated on the home pages of the Websites). If we make material changes to how we treat our users information, we will notify you by e-mail to the primary e-mail address specified in your account and through a notice on the home pages of the Websites. The date the Privacy Policy was last revised is identified at the top of the page. You are responsible for ensuring we have an up-to-date active and deliverable e-mail address for you, and for periodically visiting our Websites and this Privacy Policy to check for any changes. ","Policy Change"
"68","Your continued use of the Services after such modifications will constitute your: (a) acknowledgment of the modified Privacy Policy; and (b) agreement to abide and be bound by the modified Privacy Policy. ","User Choice/Control"
"68","Your continued use of the Services after such modifications will constitute your: (a) acknowledgment of the modified Privacy Policy; and (b) agreement to abide and be bound by the modified Privacy Policy. ","Policy Change"
"69","If we make material changes to how we use Personal Information collected from children under 13, we will notify parents by email in order to obtain verifiable parental consent for the new uses of their childs Personally Identifiable Information. ","International and Specific Audiences"
"70","15. COMMUNITIES, FORUMS, CHAT ROOMS, AND MESSAGE BOARDS If you or your child choose to disclose Personally Identifiable Information on communities, message boards, forums, and the like, which may be accessible via the Websites, you should be aware that such information, along with any information disclosed in your communication, can be collected and used by third parties and may result in unsolicited messages from third parties. To request removal of your personal information from our blog or community forum, contact us at support@lynda.com. You acknowledge and accept that any submissions to chat rooms or other public areas on the Websites are accessible to all third parties. If you do not want yours or your childs comments to be viewed by third parties, you are advised not to make any submissions. Ultimately, you are solely responsible for all activity conducted by you via communities, forums, message boards, chat rooms, etc. Please be careful and responsible whenever you are online. ","Third Party Sharing/Collection"
"71","16. SOCIAL MEDIA FEATURES Our Websites include Social Media Features, such as the Add This button or interactive mini-programs that run on our Websites. These features may collect your IP address, which pages you are visiting on our Websites, and may set cookies to enable the features to function properly. Social Media Features are either hosted by a third party or hosted directly on our Websites. Your interactions with these features are governed by the privacy policy of the company providing it. ","Third Party Sharing/Collection"
"71","16. SOCIAL MEDIA FEATURES Our Websites include Social Media Features, such as the Add This button or interactive mini-programs that run on our Websites. These features may collect your IP address, which pages you are visiting on our Websites, and may set cookies to enable the features to function properly. Social Media Features are either hosted by a third party or hosted directly on our Websites. Your interactions with these features are governed by the privacy policy of the company providing it. ","First Party Collection/Use"
"72","17. GIFT CERTIFICATES AND PLAYLISTS If you choose to send a gift certificate or playlist to an individual, we will ask you for the individuals name and email address. We will automatically send a one-time email to the individual either with notice of their gift certificate along with an activation key or an invitation to visit the Websites. The recipient will be asked to create a user name and password to activate their subscription, and during this process, they will also be asked if they want to receive any newsletters or other emails from lynda.com. lynda.com stores name and email address of the recipient for the sole purpose of sending this one-time email and tracking the success of our referral program. The individual may contact us at support@lynda.com to request that we remove this information from our database. ","Other"
"72","17. GIFT CERTIFICATES AND PLAYLISTS If you choose to send a gift certificate or playlist to an individual, we will ask you for the individuals name and email address. We will automatically send a one-time email to the individual either with notice of their gift certificate along with an activation key or an invitation to visit the Websites. The recipient will be asked to create a user name and password to activate their subscription, and during this process, they will also be asked if they want to receive any newsletters or other emails from lynda.com. lynda.com stores name and email address of the recipient for the sole purpose of sending this one-time email and tracking the success of our referral program. The individual may contact us at support@lynda.com to request that we remove this information from our database. ","User Access, Edit and Deletion"
"73","18. HOW DO YOU CONTACT US WITH QUESTIONS? If you have any questions about this Privacy Policy, the practices of or your dealings with our Websites, please contact us by sending a letter to: lynda.com, Inc. 6410 Via Real Carpinteria, CA 93013 Attn: Business Affairs Phone Number: 1 (888) 335-9632 or +1 (805) 477-3900","Privacy contact information"
"1","Effective Date: March 5, 2014 ","Policy Change"
"2","We are lynda.com, Inc., located at 6410 Via Real, Carpinteria, CA 93013, USA. We are committed to protecting and respecting your privacy. This Privacy Policy describes the types of information we may collect from you or that you may provide to us when you visit the lynda.com websites located at www.lynda.com, m.lynda.com and www.video2brain.com (the Websites) or the lynda.com mobile application (App) (collectively, the Services) , and our practices for collecting, using, maintaining, protecting and disclosing such information. This Privacy Policy applies to information we collect: (i) through our Services, (ii) in text and electronic messages between you and our Services, and (iii) via mobile applications you download from our Websites, which provide dedicated non-browser-based interactions between you and our Services. This Privacy Policy does not apply to any information collected by us offline or via third-party sites that may be accessed through hyperlinks on our Services. ","Data Security"
"2","We are lynda.com, Inc., located at 6410 Via Real, Carpinteria, CA 93013, USA. We are committed to protecting and respecting your privacy. This Privacy Policy describes the types of information we may collect from you or that you may provide to us when you visit the lynda.com websites located at www.lynda.com, m.lynda.com and www.video2brain.com (the Websites) or the lynda.com mobile application (App) (collectively, the Services) , and our practices for collecting, using, maintaining, protecting and disclosing such information. This Privacy Policy applies to information we collect: (i) through our Services, (ii) in text and electronic messages between you and our Services, and (iii) via mobile applications you download from our Websites, which provide dedicated non-browser-based interactions between you and our Services. This Privacy Policy does not apply to any information collected by us offline or via third-party sites that may be accessed through hyperlinks on our Services. ","First Party Collection/Use"
"2","We are lynda.com, Inc., located at 6410 Via Real, Carpinteria, CA 93013, USA. We are committed to protecting and respecting your privacy. This Privacy Policy describes the types of information we may collect from you or that you may provide to us when you visit the lynda.com websites located at www.lynda.com, m.lynda.com and www.video2brain.com (the Websites) or the lynda.com mobile application (App) (collectively, the Services) , and our practices for collecting, using, maintaining, protecting and disclosing such information. This Privacy Policy applies to information we collect: (i) through our Services, (ii) in text and electronic messages between you and our Services, and (iii) via mobile applications you download from our Websites, which provide dedicated non-browser-based interactions between you and our Services. This Privacy Policy does not apply to any information collected by us offline or via third-party sites that may be accessed through hyperlinks on our Services. ","Other"
"3","lynda.com has been awarded TRUSTe's Privacy and Children's Privacy Seal signifying that this Privacy Policy and practices of lynda.com, have been reviewed by TRUSTe for compliance with TRUSTe's Web Privacy and the TRUSTed Cloud Program Requirements including transparency, accountability and choice regarding the collection and use of your personal information. TRUSTe's mission, as an independent third party, is to accelerate online trust among consumers and organizations globally through its leading privacy trustmark and innovative trust solutions. If you have questions or complaints regarding our privacy policy or practices, please contact us at businessaffairs@lynda.com. If you are not satisfied with our response you can contact TRUSTe here. ","International and Specific Audiences"
"5","We self-certify compliance with the following: the U.S. E.U. Safe Harbor Framework and U.S. Swiss Safe Harbor Framework as set forth by the U.S. Department of Commerce regarding the collection, use and retention of personal data from European Union member countries and Switzerland. lynda.com has certified that it adheres to the Safe Harbor Privacy Principles of notice, choice, onward transfer, security, data integrity, access, and enforcement. To learn more about the Safe Harbor program, and to view the lynda.com certification, please visit http://www.export.gov/safeharbor. ","International and Specific Audiences"
"6","lynda.com privacy practices described in this Policy comply with the APEC Cross Border Privacy Rules System. ","International and Specific Audiences"
"7","If contacting us does not resolve your complaint, you may raise your complaint with TRUSTe by Internet here, or by fax at 415-520-3420 or by mail to: TRUSTe Safe Harbor Compliance Dept., click for mailing address. If you are faxing or mailing TRUSTe to lodge a complaint, you must include the following information: the name of company, the alleged privacy violation, your contact information, and whether you would like the particulars of your complaint shared with the company. For information about TRUSTe or the operation of TRUSTes dispute resolution process, click here or request this information from TRUSTe at any of the addresses listed above. The TRUSTe dispute resolution process shall be conducted in English. ","Privacy contact information"
"7","If contacting us does not resolve your complaint, you may raise your complaint with TRUSTe by Internet here, or by fax at 415-520-3420 or by mail to: TRUSTe Safe Harbor Compliance Dept., click for mailing address. If you are faxing or mailing TRUSTe to lodge a complaint, you must include the following information: the name of company, the alleged privacy violation, your contact information, and whether you would like the particulars of your complaint shared with the company. For information about TRUSTe or the operation of TRUSTes dispute resolution process, click here or request this information from TRUSTe at any of the addresses listed above. The TRUSTe dispute resolution process shall be conducted in English. ","Practice not covered"
